{
  "verdict": "CLEAN",
  "notes": [
    "No failed logon attempts found in the Security log.  NOTE: Windows Vista Home editions disable Failure auditing for Logon events by default \u2014 this means failed logon attempts may have occurred but were never written to the Security log.  Absence of 4625 events does NOT guarantee the password was never guessed.",
    "7184 'logon with explicit credentials' event(s) \u2014 could be a scheduled task, cached credentials, or malware."
  ],
  "totals": {
    "failed_logons": 0,
    "account_lockouts": 0,
    "password_change_events": 0,
    "explicit_credential_logons": 7184,
    "account_management_events": 0
  },
  "failed_logon_reasons": {},
  "failed_logons_by_user": {},
  "failed_logons_by_date": {},
  "lockout_events": [],
  "password_change_events": [],
  "account_management_events": [],
  "recent_failed_logons": []
}